{
  "nombre": "rainy-cabin",
  "descripcion": "Ambiente nocturno de lluvia y tormenta (canal Rainy Cabin Nights): escena WebGL en bucle perfecto, interior cálido de lámpara frente a tormenta fría, rótulos mínimos en Cormorant Garamond",
  "modo": "oscuro",
  "color": {
    "fondo": "#07090C", "superficie": "#14100D", "superficie2": "#23110A", "linea": "#837A6B",
    "texto": "#F6EAD8", "textoSuave": "#B8A68C", "acento": "#CB8856", "ok": "#8FA88A",
    "aviso": "#F1CC6D", "error": "#C8553D",
    "capitulos": ["#CB8856", "#F1CC6D", "#7393B3", "#A27167"]
  },
  "tipografia": {
    "titular":   {"familia": "Cormorant Garamond", "peso": 600, "tracking": "0.01em", "interlineado": 1},
    "cuerpo":    {"familia": "Montserrat", "peso": 400, "interlineado": 1.5},
    "etiqueta":  {"familia": "Montserrat", "peso": 500, "tracking": "0.34em", "mayusculas": true},
    "mono":      {"familia": "Montserrat", "peso": 500},
    "archivos": [
      {"familia": "Cormorant Garamond", "peso": 600, "estilo": "normal", "archivo": "fonts/cormorant-garamond-latin-ext-600-normal.woff2"},
      {"familia": "Cormorant Garamond", "peso": 600, "estilo": "normal", "archivo": "fonts/cormorant-garamond-latin-600-normal.woff2"},
      {"familia": "Montserrat", "peso": 400, "estilo": "normal", "archivo": "fonts/montserrat-latin-ext-400-normal.woff2"},
      {"familia": "Montserrat", "peso": 400, "estilo": "normal", "archivo": "fonts/montserrat-latin-400-normal.woff2"},
      {"familia": "Montserrat", "peso": 500, "estilo": "normal", "archivo": "fonts/montserrat-latin-ext-500-normal.woff2"},
      {"familia": "Montserrat", "peso": 500, "estilo": "normal", "archivo": "fonts/montserrat-latin-500-normal.woff2"}
    ]
  },
  "forma": {"radio": 12, "radioPildora": 999, "borde": 2, "sombra": "0 4px 30px rgba(0,0,0,0.55)"},
  "fondo": {"tipo": "radial", "detalle": "la escena WebGL a sangre (interior de madera cálido + tormenta azul al otro lado del cristal); bajo cada rótulo, sombra elíptica rgba(6,8,11,0.62) → 0"},
  "paneles": {"estilo": "solido"},
  "ponente": {"marco": "ninguno", "borde": false},
  "subtitulos": {"estilo": "limpio", "palabraActiva": "ninguna"},
  "movimiento": {"energia": "baja", "entrada": "power2Out", "duracionEntrada": 1.8, "transicion": "fundido"},
  "tres": {"material": "estandar", "contornoTinta": false, "rampa": 3},
  "audio": {"musica": "ninguna", "sfx": "ambiente"},
  "licencias": "Cormorant Garamond, Montserrat: SIL Open Font License 1.1 (fonts/OFL-*.txt), woff2 de @fontsource 5.3.0 (subconjuntos latin y latin-ext). Mismas familias que videos-opus/videos/brand-fonts (TTF variables)."
}
