{
  "nombre": "lanzamiento-dinamico",
  "descripcion": "Variante de lanzamiento-minimal para anuncios de producto muy dinámicos: misma paleta de la web de OpenWebinars más campos de color violeta profundo, degradados violeta→rosa, spring con rebote, desenfoque de movimiento en cada corte, cámara virtual y el orbe del agente como hilo",
  "modo": "claro",
  "color": {
    "fondo": "#FAFBFC",
    "superficie": "#FFFFFF",
    "superficie2": "#F2F4F7",
    "linea": "#E4E7EC",
    "texto": "#0D1320",
    "textoSuave": "#667085",
    "acento": "#7D29E0",
    "ok": "#067647",
    "aviso": "#B54708",
    "error": "#D92D20",
    "capitulos": [
      "#7D29E0",
      "#FF01A2",
      "#5E3DE6",
      "#9B61F6"
    ]
  },
  "tipografia": {
    "titular": {
      "familia": "Inter",
      "peso": 800,
      "tracking": "-0.04em",
      "interlineado": 1.02
    },
    "cuerpo": {
      "familia": "Inter",
      "peso": 400,
      "interlineado": 1.4
    },
    "etiqueta": {
      "familia": "Inter",
      "peso": 600,
      "tracking": "0.18em",
      "mayusculas": true
    },
    "mono": {
      "familia": "JetBrains Mono",
      "peso": 400
    },
    "archivos": [
      {
        "familia": "Inter",
        "peso": 400,
        "estilo": "normal",
        "archivo": "fonts/inter-latin-ext-400-normal.woff2"
      },
      {
        "familia": "Inter",
        "peso": 400,
        "estilo": "normal",
        "archivo": "fonts/inter-latin-400-normal.woff2"
      },
      {
        "familia": "Inter",
        "peso": 600,
        "estilo": "normal",
        "archivo": "fonts/inter-latin-ext-600-normal.woff2"
      },
      {
        "familia": "Inter",
        "peso": 600,
        "estilo": "normal",
        "archivo": "fonts/inter-latin-600-normal.woff2"
      },
      {
        "familia": "Inter",
        "peso": 800,
        "estilo": "normal",
        "archivo": "fonts/inter-latin-ext-800-normal.woff2"
      },
      {
        "familia": "Inter",
        "peso": 800,
        "estilo": "normal",
        "archivo": "fonts/inter-latin-800-normal.woff2"
      },
      {
        "familia": "JetBrains Mono",
        "peso": 400,
        "estilo": "normal",
        "archivo": "fonts/jetbrains-mono-latin-ext-400-normal.woff2"
      },
      {
        "familia": "JetBrains Mono",
        "peso": 400,
        "estilo": "normal",
        "archivo": "fonts/jetbrains-mono-latin-400-normal.woff2"
      }
    ]
  },
  "forma": {
    "radio": 28,
    "radioPildora": 999,
    "borde": 1,
    "sombra": "0 24px 60px rgba(13,19,32,0.10)"
  },
  "fondo": {
    "tipo": "radial",
    "detalle": "fondo #FAFBFC liso con un resplandor radial violeta #7D29E0 → rosa #FF01A2 de 1600 px centrado abajo (≈960, 1250) al 14 %, que respira muy despacio (±4 % de opacidad en 12 s)"
  },
  "paneles": {
    "estilo": "solido"
  },
  "ponente": {
    "marco": "redondeado",
    "borde": false
  },
  "subtitulos": {
    "estilo": "limpio",
    "palabraActiva": "acento"
  },
  "movimiento": {
    "energia": "alta",
    "entrada": "backOut",
    "duracionEntrada": 0.55,
    "transicion": "barrido"
  },
  "tres": {
    "material": "estandar",
    "contornoTinta": false,
    "rampa": 3
  },
  "audio": {
    "musica": "electronica",
    "sfx": "marcados"
  },
  "licencias": "Inter, JetBrains Mono: SIL Open Font License 1.1 (fonts/OFL-*.txt), woff2 de @fontsource 5.3.0 (subconjuntos latin y latin-ext).",
  "escenario": {
    "lienzo": "#F2F4F7",
    "patron": false,
    "camara": {
      "fondo": "#EFE6FB",
      "fondo2": "#E2D2F7"
    }
  },
  "registros": {
    "editorial": {
      "familiaTitular": "Inter",
      "familiaCuerpo": "Inter",
      "mayusculas": false,
      "oro": "#7D29E0"
    }
  },
  "marca": {
    "fondo": "#5B17B5",
    "oscuro": "#2A0A57",
    "bitono": "#D9C2FA",
    "rotulo": "#2A0A57",
    "cargo": "#FF7AD0",
    "texto": "#FFFFFF",
    "palabra": "#D9C2FA",
    "familia": "Inter"
  }
}