{
  "nombre": "prueba-claro",
  "descripcion": "Estilo de desarrollo del motor, claro: papel cálido, paneles de tinta, 3D toon con contorno de tinta",
  "modo": "claro",
  "color": {
    "fondo": "#F4EFE6", "superficie": "#FFFDF8", "superficie2": "#F3E3C8", "linea": "#D8CBB3",
    "texto": "#1E1B18", "textoSuave": "#5B544C", "acento": "#C8402A", "ok": "#2F8F5B",
    "aviso": "#B7790C", "error": "#C23A3A",
    "capitulos": ["#C8402A", "#2B64A8", "#2F8F5B", "#8E44AD"]
  },
  "tipografia": {
    "titular":  { "familia": "Space Grotesk", "peso": 700, "tracking": "-0.02em", "interlineado": 1.04 },
    "cuerpo":   { "familia": "Inter", "peso": 400, "interlineado": 1.4 },
    "etiqueta": { "familia": "Space Grotesk", "peso": 500, "tracking": "0.16em", "mayusculas": true },
    "mono":     { "familia": "Inter", "peso": 400 },
    "archivos": [
      { "familia": "Space Grotesk", "peso": 500, "estilo": "normal", "archivo": "fonts/space-grotesk-latin-ext-500-normal.woff2" },
      { "familia": "Space Grotesk", "peso": 500, "estilo": "normal", "archivo": "fonts/space-grotesk-latin-500-normal.woff2" },
      { "familia": "Space Grotesk", "peso": 700, "estilo": "normal", "archivo": "fonts/space-grotesk-latin-ext-700-normal.woff2" },
      { "familia": "Space Grotesk", "peso": 700, "estilo": "normal", "archivo": "fonts/space-grotesk-latin-700-normal.woff2" },
      { "familia": "Inter", "peso": 400, "estilo": "normal", "archivo": "fonts/inter-latin-ext-400-normal.woff2" },
      { "familia": "Inter", "peso": 400, "estilo": "normal", "archivo": "fonts/inter-latin-400-normal.woff2" },
      { "familia": "Inter", "peso": 600, "estilo": "normal", "archivo": "fonts/inter-latin-ext-600-normal.woff2" },
      { "familia": "Inter", "peso": 600, "estilo": "normal", "archivo": "fonts/inter-latin-600-normal.woff2" }
    ]
  },
  "forma": { "radio": 18, "radioPildora": 999, "borde": 3, "sombra": "0 18px 40px rgba(30,27,24,0.16)" },
  "fondo": { "tipo": "papel", "detalle": "papel cálido con fibra fina y viñeta suave" },
  "paneles": { "estilo": "tinta" },
  "ponente": { "marco": "arco", "borde": true },
  "subtitulos": { "estilo": "limpio", "palabraActiva": "subrayado" },
  "movimiento": { "energia": "alta", "entrada": "backOut", "duracionEntrada": 0.5, "transicion": "barrido" },
  "tres": { "material": "toon", "contornoTinta": true, "rampa": 3 },
  "audio": { "musica": "ninguna", "sfx": "suaves" },
  "licencias": "Space Grotesk, Inter: SIL Open Font License 1.1 (fonts/OFL-*.txt), woff2 de @fontsource (copiados de estilos/clase-oscura-cristal)."
}
