{
  "nombre": "curso-azul",
  "descripcion": "Curso corporativo azul marino y blanco: Montserrat 900, resplandor de acento, paneles sólidos redondeados, 3D con luces y sombras",
  "modo": "oscuro",
  "color": {
    "fondo": "#071631", "superficie": "#0D2552", "superficie2": "#13306A", "linea": "#1F3F7A",
    "texto": "#F3F7FF", "textoSuave": "#A8BCE3", "acento": "#4C8DFF", "ok": "#3DDC97",
    "aviso": "#FFB547", "error": "#FF6B6B",
    "capitulos": ["#4C8DFF", "#8B7CFF", "#2EC5CE", "#FFB547"]
  },
  "tipografia": {
    "titular":   {"familia": "Montserrat", "peso": 900, "tracking": "-0.02em", "interlineado": 1.05},
    "cuerpo":    {"familia": "Montserrat", "peso": 400, "interlineado": 1.35},
    "etiqueta":  {"familia": "Montserrat", "peso": 700, "tracking": "0.24em", "mayusculas": true},
    "mono":      {"familia": "JetBrains Mono", "peso": 400},
    "archivos": [
      {"familia": "Montserrat", "peso": 400, "estilo": "normal", "archivo": "fonts/montserrat-latin-ext-400-normal.woff2"},
      {"familia": "Montserrat", "peso": 400, "estilo": "normal", "archivo": "fonts/montserrat-latin-400-normal.woff2"},
      {"familia": "Montserrat", "peso": 700, "estilo": "normal", "archivo": "fonts/montserrat-latin-ext-700-normal.woff2"},
      {"familia": "Montserrat", "peso": 700, "estilo": "normal", "archivo": "fonts/montserrat-latin-700-normal.woff2"},
      {"familia": "Montserrat", "peso": 900, "estilo": "normal", "archivo": "fonts/montserrat-latin-ext-900-normal.woff2"},
      {"familia": "Montserrat", "peso": 900, "estilo": "normal", "archivo": "fonts/montserrat-latin-900-normal.woff2"},
      {"familia": "JetBrains Mono", "peso": 400, "estilo": "normal", "archivo": "fonts/jetbrains-mono-latin-ext-400-normal.woff2"},
      {"familia": "JetBrains Mono", "peso": 400, "estilo": "normal", "archivo": "fonts/jetbrains-mono-latin-400-normal.woff2"}
    ]
  },
  "forma": {"radio": 22, "radioPildora": 999, "borde": 2, "sombra": "0 30px 80px rgba(4,12,31,0.45)"},
  "fondo": {"tipo": "radial", "detalle": "azul marino liso con un resplandor radial del acento de 1400 px arriba a la derecha (≈1500, 200) al 22 %, que deriva despacio"},
  "paneles": {"estilo": "solido"},
  "ponente": {"marco": "redondeado", "borde": true},
  "subtitulos": {"estilo": "caja", "palabraActiva": "acento"},
  "movimiento": {"energia": "media", "entrada": "power3Out", "duracionEntrada": 0.6, "transicion": "empuje"},
  "tres": {"material": "estandar", "contornoTinta": false, "rampa": 3},
  "audio": {"musica": "pad", "sfx": "suaves"},
  "licencias": "Montserrat, JetBrains Mono: SIL Open Font License 1.1 (fonts/OFL-*.txt), woff2 de @fontsource 5.3.0 (subconjuntos latin y latin-ext)."
}
