{
  "nombre": "lanzamiento-minimal",
  "descripcion": "Lanzamiento minimalista con la paleta de la web de OpenWebinars: fondo casi blanco, titulares Inter 800 en tinta con una palabra en violeta, paneles blancos con borde fino, resplandor suave violeta→rosa y movimiento lento con expoOut y fundidos",
  "modo": "claro",
  "color": {
    "fondo": "#FAFBFC",
    "superficie": "#FFFFFF",
    "superficie2": "#F2F4F7",
    "linea": "#E4E7EC",
    "texto": "#0D1320",
    "textoSuave": "#667085",
    "acento": "#7D29E0",
    "ok": "#067647",
    "aviso": "#B54708",
    "error": "#D92D20",
    "capitulos": [
      "#7D29E0",
      "#FF01A2",
      "#5E3DE6",
      "#9B61F6"
    ]
  },
  "tipografia": {
    "titular": {
      "familia": "Inter",
      "peso": 800,
      "tracking": "-0.04em",
      "interlineado": 1.02
    },
    "cuerpo": {
      "familia": "Inter",
      "peso": 400,
      "interlineado": 1.4
    },
    "etiqueta": {
      "familia": "Inter",
      "peso": 600,
      "tracking": "0.18em",
      "mayusculas": true
    },
    "mono": {
      "familia": "JetBrains Mono",
      "peso": 400
    },
    "archivos": [
      {
        "familia": "Inter",
        "peso": 400,
        "estilo": "normal",
        "archivo": "fonts/inter-latin-ext-400-normal.woff2"
      },
      {
        "familia": "Inter",
        "peso": 400,
        "estilo": "normal",
        "archivo": "fonts/inter-latin-400-normal.woff2"
      },
      {
        "familia": "Inter",
        "peso": 600,
        "estilo": "normal",
        "archivo": "fonts/inter-latin-ext-600-normal.woff2"
      },
      {
        "familia": "Inter",
        "peso": 600,
        "estilo": "normal",
        "archivo": "fonts/inter-latin-600-normal.woff2"
      },
      {
        "familia": "Inter",
        "peso": 800,
        "estilo": "normal",
        "archivo": "fonts/inter-latin-ext-800-normal.woff2"
      },
      {
        "familia": "Inter",
        "peso": 800,
        "estilo": "normal",
        "archivo": "fonts/inter-latin-800-normal.woff2"
      },
      {
        "familia": "JetBrains Mono",
        "peso": 400,
        "estilo": "normal",
        "archivo": "fonts/jetbrains-mono-latin-ext-400-normal.woff2"
      },
      {
        "familia": "JetBrains Mono",
        "peso": 400,
        "estilo": "normal",
        "archivo": "fonts/jetbrains-mono-latin-400-normal.woff2"
      }
    ]
  },
  "forma": {
    "radio": 28,
    "radioPildora": 999,
    "borde": 1,
    "sombra": "0 24px 60px rgba(13,19,32,0.10)"
  },
  "fondo": {
    "tipo": "radial",
    "detalle": "fondo #FAFBFC liso con un resplandor radial violeta #7D29E0 → rosa #FF01A2 de 1600 px centrado abajo (≈960, 1250) al 14 %, que respira muy despacio (±4 % de opacidad en 12 s)"
  },
  "paneles": {
    "estilo": "solido"
  },
  "ponente": {
    "marco": "redondeado",
    "borde": false
  },
  "subtitulos": {
    "estilo": "limpio",
    "palabraActiva": "acento"
  },
  "movimiento": {
    "energia": "baja",
    "entrada": "expoOut",
    "duracionEntrada": 0.9,
    "transicion": "fundido"
  },
  "tres": {
    "material": "estandar",
    "contornoTinta": false,
    "rampa": 3
  },
  "audio": {
    "musica": "pad",
    "sfx": "suaves"
  },
  "licencias": "Inter, JetBrains Mono: SIL Open Font License 1.1 (fonts/OFL-*.txt), woff2 de @fontsource 5.3.0 (subconjuntos latin y latin-ext)."
}
