{
  "nombre": "milikito",
  "descripcion": "Masterclass en directo con alma de show: escenario de webinar verde casi negro con cajas redondeadas (diapositiva + cámara del ponente sobre menta), diapositivas «show» azul eléctrico con rayos, destellos dorados y titulares de videojuego (degradado oro→naranja, doble contorno, sombra), diapositivas editoriales azul marino con condensada y palabras clave en oro, y láminas de cómic con bocadillos. Versión dinamizada: más motion graphics que el original.",
  "modo": "oscuro",
  "color": {
    "fondo": "#102424",
    "superficie": "#041839",
    "superficie2": "#1322CF",
    "linea": "#2B4A4A",
    "texto": "#F2F3F8",
    "textoSuave": "#B4C8C6",
    "acento": "#F5C121",
    "ok": "#3DDC97",
    "aviso": "#FF9A3C",
    "error": "#FF6B6B",
    "capitulos": [
      "#F5C121",
      "#FF9A3C",
      "#9CE5DF",
      "#8FB2FF"
    ],
    "sobreAcento": "#1A1206",
    "tinta": "#06103E"
  },
  "tipografia": {
    "titular": {
      "familia": "Fredoka",
      "peso": 700,
      "tracking": "-0.01em",
      "interlineado": 1.0,
      "tratamiento": "juego"
    },
    "cuerpo": {
      "familia": "Nunito",
      "peso": 700,
      "interlineado": 1.3
    },
    "etiqueta": {
      "familia": "Barlow Condensed",
      "peso": 700,
      "tracking": "0.06em",
      "mayusculas": true
    },
    "mono": {
      "familia": "JetBrains Mono",
      "peso": 400
    },
    "archivos": [
      {
        "familia": "Fredoka",
        "peso": 600,
        "estilo": "normal",
        "archivo": "fonts/fredoka-latin-ext-600-normal.woff2"
      },
      {
        "familia": "Fredoka",
        "peso": 600,
        "estilo": "normal",
        "archivo": "fonts/fredoka-latin-600-normal.woff2"
      },
      {
        "familia": "Fredoka",
        "peso": 700,
        "estilo": "normal",
        "archivo": "fonts/fredoka-latin-ext-700-normal.woff2"
      },
      {
        "familia": "Fredoka",
        "peso": 700,
        "estilo": "normal",
        "archivo": "fonts/fredoka-latin-700-normal.woff2"
      },
      {
        "familia": "Nunito",
        "peso": 700,
        "estilo": "normal",
        "archivo": "fonts/nunito-latin-ext-700-normal.woff2"
      },
      {
        "familia": "Nunito",
        "peso": 700,
        "estilo": "normal",
        "archivo": "fonts/nunito-latin-700-normal.woff2"
      },
      {
        "familia": "Nunito",
        "peso": 800,
        "estilo": "normal",
        "archivo": "fonts/nunito-latin-ext-800-normal.woff2"
      },
      {
        "familia": "Nunito",
        "peso": 800,
        "estilo": "normal",
        "archivo": "fonts/nunito-latin-800-normal.woff2"
      },
      {
        "familia": "Nunito",
        "peso": 900,
        "estilo": "normal",
        "archivo": "fonts/nunito-latin-ext-900-normal.woff2"
      },
      {
        "familia": "Nunito",
        "peso": 900,
        "estilo": "normal",
        "archivo": "fonts/nunito-latin-900-normal.woff2"
      },
      {
        "familia": "Barlow Condensed",
        "peso": 600,
        "estilo": "normal",
        "archivo": "fonts/barlow-condensed-latin-ext-600-normal.woff2"
      },
      {
        "familia": "Barlow Condensed",
        "peso": 600,
        "estilo": "normal",
        "archivo": "fonts/barlow-condensed-latin-600-normal.woff2"
      },
      {
        "familia": "Barlow Condensed",
        "peso": 700,
        "estilo": "normal",
        "archivo": "fonts/barlow-condensed-latin-ext-700-normal.woff2"
      },
      {
        "familia": "Barlow Condensed",
        "peso": 700,
        "estilo": "normal",
        "archivo": "fonts/barlow-condensed-latin-700-normal.woff2"
      },
      {
        "familia": "Barlow Condensed",
        "peso": 800,
        "estilo": "normal",
        "archivo": "fonts/barlow-condensed-latin-ext-800-normal.woff2"
      },
      {
        "familia": "Barlow Condensed",
        "peso": 800,
        "estilo": "normal",
        "archivo": "fonts/barlow-condensed-latin-800-normal.woff2"
      },
      {
        "familia": "Barlow Semi Condensed",
        "peso": 400,
        "estilo": "normal",
        "archivo": "fonts/barlow-semi-condensed-latin-ext-400-normal.woff2"
      },
      {
        "familia": "Barlow Semi Condensed",
        "peso": 400,
        "estilo": "normal",
        "archivo": "fonts/barlow-semi-condensed-latin-400-normal.woff2"
      },
      {
        "familia": "Barlow Semi Condensed",
        "peso": 500,
        "estilo": "normal",
        "archivo": "fonts/barlow-semi-condensed-latin-ext-500-normal.woff2"
      },
      {
        "familia": "Barlow Semi Condensed",
        "peso": 500,
        "estilo": "normal",
        "archivo": "fonts/barlow-semi-condensed-latin-500-normal.woff2"
      },
      {
        "familia": "Inter",
        "peso": 300,
        "estilo": "normal",
        "archivo": "fonts/inter-latin-ext-300-normal.woff2"
      },
      {
        "familia": "Inter",
        "peso": 300,
        "estilo": "normal",
        "archivo": "fonts/inter-latin-300-normal.woff2"
      },
      {
        "familia": "Inter",
        "peso": 400,
        "estilo": "normal",
        "archivo": "fonts/inter-latin-ext-400-normal.woff2"
      },
      {
        "familia": "Inter",
        "peso": 400,
        "estilo": "normal",
        "archivo": "fonts/inter-latin-400-normal.woff2"
      },
      {
        "familia": "Inter",
        "peso": 700,
        "estilo": "italic",
        "archivo": "fonts/inter-latin-ext-700-italic.woff2"
      },
      {
        "familia": "Inter",
        "peso": 700,
        "estilo": "italic",
        "archivo": "fonts/inter-latin-700-italic.woff2"
      },
      {
        "familia": "Inter",
        "peso": 700,
        "estilo": "normal",
        "archivo": "fonts/inter-latin-ext-700-normal.woff2"
      },
      {
        "familia": "Inter",
        "peso": 700,
        "estilo": "normal",
        "archivo": "fonts/inter-latin-700-normal.woff2"
      },
      {
        "familia": "Comic Neue",
        "peso": 700,
        "estilo": "normal",
        "archivo": "fonts/comic-neue-latin-700-normal.woff2"
      },
      {
        "familia": "JetBrains Mono",
        "peso": 400,
        "estilo": "normal",
        "archivo": "fonts/jetbrains-mono-latin-ext-400-normal.woff2"
      },
      {
        "familia": "JetBrains Mono",
        "peso": 400,
        "estilo": "normal",
        "archivo": "fonts/jetbrains-mono-latin-400-normal.woff2"
      }
    ]
  },
  "forma": {
    "radio": 20,
    "radioPildora": 999,
    "borde": 3,
    "sombra": "0 18px 48px rgba(0,0,0,0.45)"
  },
  "fondo": {
    "tipo": "rejilla",
    "detalle": "lienzo verde casi negro #102424 con cuadraditos girados 45° (≈40 px, #142928, 4–6 % más de luz) que asoman solo en las esquinas; en las diapositivas «show», rayos azul eléctrico desde el centro (#2940DD→#040E90) con destellos dorados de cuatro puntas",
    "grano": 0,
    "rayos": {
      "colores": [
        "#2940DD",
        "#080CDC"
      ],
      "vineta": "#040E90",
      "giro": 2,
      "destellos": 8
    }
  },
  "paneles": {
    "estilo": "solido"
  },
  "ponente": {
    "marco": "redondeado",
    "borde": false
  },
  "subtitulos": {
    "estilo": "caja",
    "palabraActiva": "acento"
  },
  "movimiento": {
    "energia": "alta",
    "entrada": "backOut",
    "duracionEntrada": 0.45,
    "transicion": "zoom"
  },
  "tres": {
    "material": "toon",
    "contornoTinta": true,
    "rampa": 3
  },
  "audio": {
    "musica": "sintonía enérgica de marca en apertura y cierre; base rítmica suave (≈ −28 LUFS bajo la voz) opcional en tramos largos",
    "sfx": "destello (sparkle) en titulares dorados, whoosh en empujes, pop en bocadillos y fichas, golpe grave en «revelaciones»"
  },
  "licencias": "Fredoka, Nunito, Barlow Condensed, Barlow Semi Condensed, Inter, Comic Neue y JetBrains Mono: SIL Open Font License 1.1 (fonts/OFL-*.txt), woff2 de @fontsource (latin y latin-ext; Comic Neue solo latin).",
  "escenario": {
    "activo": true,
    "lienzo": "#102424",
    "patron": true,
    "caja": {
      "radio": 20,
      "sombra": "0 18px 48px rgba(0,0,0,.45)"
    },
    "camara": {
      "fondo": "#9CE5DF",
      "fondo2": "#7FDCD6"
    }
  },
  "hud": {
    "estilo": "fichas"
  },
  "registros": {
    "show": {
      "fondo": "rayos",
      "titular": "juego"
    },
    "editorial": {
      "fondo": "#041839",
      "familiaTitular": "Barlow Condensed",
      "familiaCuerpo": "Barlow Semi Condensed",
      "oro": "#D1A54B",
      "anillos": true
    },
    "lamina": {
      "zoom": [
        1.0,
        1.06
      ]
    }
  }
}