{
  "nombre": "vox-corto",
  "descripcion": "Explainer corto editorial al estilo Vox para Shorts/Reels/TikTok y YouTube (9:16 y 16:9): tinta casi negra, amarillo de acento, Archivo 900 en mayúsculas, cortes rápidos",
  "modo": "oscuro",
  "color": {
    "fondo": "#0B0B0C", "superficie": "#0F0F14", "superficie2": "#2A2A30", "linea": "#2C2C36",
    "texto": "#FFFFFF", "textoSuave": "#9A9AA2", "acento": "#FFE500", "ok": "#3DDC97",
    "aviso": "#FF9F1C", "error": "#FF4D4D",
    "capitulos": ["#FFE500", "#FFE500", "#FFE500", "#FFE500"]
  },
  "tipografia": {
    "titular":   {"familia": "Archivo", "peso": 900, "tracking": "-0.03em", "interlineado": 0.98, "mayusculas": true},
    "cuerpo":    {"familia": "Archivo", "peso": 700, "interlineado": 1.24},
    "etiqueta":  {"familia": "Archivo", "peso": 800, "tracking": "0.11em", "mayusculas": true},
    "mono":      {"familia": "Archivo", "peso": 700},
    "archivos": [
      {"familia": "Archivo", "peso": 700, "estilo": "normal", "archivo": "fonts/archivo-latin-ext-700-normal.woff2"},
      {"familia": "Archivo", "peso": 700, "estilo": "normal", "archivo": "fonts/archivo-latin-700-normal.woff2"},
      {"familia": "Archivo", "peso": 800, "estilo": "normal", "archivo": "fonts/archivo-latin-ext-800-normal.woff2"},
      {"familia": "Archivo", "peso": 800, "estilo": "normal", "archivo": "fonts/archivo-latin-800-normal.woff2"},
      {"familia": "Archivo", "peso": 900, "estilo": "normal", "archivo": "fonts/archivo-latin-ext-900-normal.woff2"},
      {"familia": "Archivo", "peso": 900, "estilo": "normal", "archivo": "fonts/archivo-latin-900-normal.woff2"}
    ]
  },
  "forma": {"radio": 0, "radioPildora": 0, "borde": 4, "sombra": "0 20px 60px rgba(0,0,0,0.55)"},
  "fondo": {"tipo": "liso", "detalle": "tinta casi negra; B-roll a sangre con Ken Burns alterno (in/out) y degradado .scrim de abajo arriba (0,95 → 0,34)"},
  "paneles": {"estilo": "solido"},
  "ponente": {"marco": "recto", "borde": false},
  "subtitulos": {"estilo": "limpio", "palabraActiva": "acento"},
  "movimiento": {"energia": "alta", "entrada": "expoOut", "duracionEntrada": 0.35, "transicion": "zoom"},
  "tres": {"material": "estandar", "contornoTinta": false, "rampa": 3},
  "audio": {"musica": "electronica", "sfx": "marcados"},
  "licencias": "Archivo: SIL Open Font License 1.1 (fonts/OFL-*.txt), woff2 de @fontsource 5.3.0 (subconjuntos latin y latin-ext)."
}
