{
  "nombre": "ensaya-conversation-club",
  "descripcion": "Marca Ensaya · Conversation Club en su registro tinta/bosque: marfil sobre tinta, un único acento lima que actúa de rotulador, Inter Tight 800 muy apretada y DM Sans",
  "modo": "oscuro",
  "color": {
    "fondo": "#10231D", "superficie": "#173F32", "superficie2": "#192B25", "linea": "#35453F",
    "texto": "#F7F8F2", "textoSuave": "#B6C6BB", "acento": "#D6F469", "ok": "#8EE0A1",
    "aviso": "#F2D16B", "error": "#FF8A73",
    "capitulos": ["#D6F469", "#D6F469", "#D6F469", "#D6F469"]
  },
  "tipografia": {
    "titular":   {"familia": "Inter Tight", "peso": 800, "tracking": "-0.04em", "interlineado": 1},
    "cuerpo":    {"familia": "DM Sans", "peso": 400, "interlineado": 1.4},
    "etiqueta":  {"familia": "DM Sans", "peso": 700, "tracking": "0.18em", "mayusculas": true},
    "mono":      {"familia": "DM Mono", "peso": 400},
    "archivos": [
      {"familia": "Inter Tight", "peso": 800, "estilo": "normal", "archivo": "fonts/inter-tight-latin-ext-800-normal.woff2"},
      {"familia": "Inter Tight", "peso": 800, "estilo": "normal", "archivo": "fonts/inter-tight-latin-800-normal.woff2"},
      {"familia": "DM Sans", "peso": 400, "estilo": "normal", "archivo": "fonts/dm-sans-latin-ext-400-normal.woff2"},
      {"familia": "DM Sans", "peso": 400, "estilo": "normal", "archivo": "fonts/dm-sans-latin-400-normal.woff2"},
      {"familia": "DM Sans", "peso": 700, "estilo": "normal", "archivo": "fonts/dm-sans-latin-ext-700-normal.woff2"},
      {"familia": "DM Sans", "peso": 700, "estilo": "normal", "archivo": "fonts/dm-sans-latin-700-normal.woff2"},
      {"familia": "DM Mono", "peso": 400, "estilo": "normal", "archivo": "fonts/dm-mono-latin-ext-400-normal.woff2"},
      {"familia": "DM Mono", "peso": 400, "estilo": "normal", "archivo": "fonts/dm-mono-latin-400-normal.woff2"}
    ]
  },
  "forma": {"radio": 32, "radioPildora": 999, "borde": 2, "sombra": "0 30px 60px rgba(16,35,29,0.16)"},
  "fondo": {"tipo": "radial", "detalle": "tinta a sangre con halo bosque muy suave; en el registro marfil (#F7F8F2) retícula de puntos de tinta al 16 % cada 44 px"},
  "paneles": {"estilo": "solido"},
  "ponente": {"marco": "arco", "borde": false},
  "subtitulos": {"estilo": "caja", "palabraActiva": "acento"},
  "movimiento": {"energia": "alta", "entrada": "expoOut", "duracionEntrada": 0.5, "transicion": "empuje"},
  "tres": {"material": "estandar", "contornoTinta": false, "rampa": 3},
  "audio": {"musica": "electronica", "sfx": "marcados"},
  "licencias": "Inter Tight, DM Sans, DM Mono: SIL Open Font License 1.1 (fonts/OFL-*.txt), woff2 de @fontsource 5.3.0 (subconjuntos latin y latin-ext)."
}
