{
  "nombre": "clase-oscura-cristal",
  "descripcion": "Clase larga moderna y oscura: paneles de cristal, acento por capítulo (violeta, cian, dorado, rojo), Space Grotesk en titulares e Inter en el texto, subtítulos con la palabra activa en el color del capítulo",
  "modo": "oscuro",
  "color": {
    "fondo": "#0A0B14", "superficie": "#161827", "superficie2": "#1F2236", "linea": "#2E3250",
    "texto": "#F5F6FC", "textoSuave": "#A7ADC8", "acento": "#9B7BFF", "ok": "#34D399",
    "aviso": "#FBBF24", "error": "#F87171",
    "capitulos": ["#9B7BFF", "#22D3EE", "#F5B84A", "#FF5C6C"]
  },
  "tipografia": {
    "titular":   {"familia": "Space Grotesk", "peso": 700, "tracking": "-0.02em", "interlineado": 1.05},
    "cuerpo":    {"familia": "Inter", "peso": 400, "interlineado": 1.45},
    "etiqueta":  {"familia": "Space Grotesk", "peso": 500, "tracking": "0.18em", "mayusculas": true},
    "mono":      {"familia": "JetBrains Mono", "peso": 400},
    "archivos": [
      {"familia": "Space Grotesk", "peso": 500, "estilo": "normal", "archivo": "fonts/space-grotesk-latin-ext-500-normal.woff2"},
      {"familia": "Space Grotesk", "peso": 500, "estilo": "normal", "archivo": "fonts/space-grotesk-latin-500-normal.woff2"},
      {"familia": "Space Grotesk", "peso": 700, "estilo": "normal", "archivo": "fonts/space-grotesk-latin-ext-700-normal.woff2"},
      {"familia": "Space Grotesk", "peso": 700, "estilo": "normal", "archivo": "fonts/space-grotesk-latin-700-normal.woff2"},
      {"familia": "Inter", "peso": 400, "estilo": "normal", "archivo": "fonts/inter-latin-ext-400-normal.woff2"},
      {"familia": "Inter", "peso": 400, "estilo": "normal", "archivo": "fonts/inter-latin-400-normal.woff2"},
      {"familia": "Inter", "peso": 600, "estilo": "normal", "archivo": "fonts/inter-latin-ext-600-normal.woff2"},
      {"familia": "Inter", "peso": 600, "estilo": "normal", "archivo": "fonts/inter-latin-600-normal.woff2"},
      {"familia": "JetBrains Mono", "peso": 400, "estilo": "normal", "archivo": "fonts/jetbrains-mono-latin-ext-400-normal.woff2"},
      {"familia": "JetBrains Mono", "peso": 400, "estilo": "normal", "archivo": "fonts/jetbrains-mono-latin-400-normal.woff2"}
    ]
  },
  "forma": {"radio": 28, "radioPildora": 999, "borde": 2, "sombra": "0 24px 70px rgba(0,0,0,0.5)"},
  "fondo": {"tipo": "radial", "detalle": "negro azulado con dos halos radiales del color del capítulo (15–25 %) y grano fino; nunca degradados lineales a pantalla completa"},
  "paneles": {"estilo": "cristal"},
  "ponente": {"marco": "redondeado", "borde": true},
  "subtitulos": {"estilo": "caja", "palabraActiva": "capitulo"},
  "movimiento": {"energia": "media", "entrada": "power3Out", "duracionEntrada": 0.6, "transicion": "fundido"},
  "tres": {"material": "toon", "contornoTinta": true, "rampa": 3},
  "audio": {"musica": "ninguna", "sfx": "suaves"},
  "licencias": "Space Grotesk, Inter, JetBrains Mono: SIL Open Font License 1.1 (fonts/OFL-*.txt), woff2 de @fontsource 5.3.0 (subconjuntos latin y latin-ext)."
}
