{
  "nombre": "acuarela-ilustrada",
  "descripcion": "Pieza corta con ilustraciones de acuarela: papel cálido, tarjetas blancas, chips y recuadros dibujados sobre el dibujo, paleta sacada de las propias ilustraciones",
  "modo": "claro",
  "color": {
    "fondo": "#FBF7EF", "superficie": "#FFFFFF", "superficie2": "#F3E9D8", "linea": "#D8CBB6",
    "texto": "#2A2833", "textoSuave": "#5F5A66", "acento": "#B5472F", "ok": "#2F7A5B",
    "aviso": "#8A6212", "error": "#B23A3A",
    "capitulos": ["#B5472F", "#1F6F78", "#8A6212", "#6E4A7E"]
  },
  "tipografia": {
    "titular":   {"familia": "Nunito", "peso": 800, "tracking": "-0.01em", "interlineado": 1.08},
    "cuerpo":    {"familia": "Nunito", "peso": 400, "interlineado": 1.4},
    "etiqueta":  {"familia": "Caveat", "peso": 700, "tracking": "0em", "mayusculas": false},
    "mono":      {"familia": "JetBrains Mono", "peso": 400},
    "archivos": [
      {"familia": "Nunito", "peso": 400, "estilo": "normal", "archivo": "fonts/nunito-latin-ext-400-normal.woff2"},
      {"familia": "Nunito", "peso": 400, "estilo": "normal", "archivo": "fonts/nunito-latin-400-normal.woff2"},
      {"familia": "Nunito", "peso": 600, "estilo": "normal", "archivo": "fonts/nunito-latin-ext-600-normal.woff2"},
      {"familia": "Nunito", "peso": 600, "estilo": "normal", "archivo": "fonts/nunito-latin-600-normal.woff2"},
      {"familia": "Nunito", "peso": 800, "estilo": "normal", "archivo": "fonts/nunito-latin-ext-800-normal.woff2"},
      {"familia": "Nunito", "peso": 800, "estilo": "normal", "archivo": "fonts/nunito-latin-800-normal.woff2"},
      {"familia": "Caveat", "peso": 700, "estilo": "normal", "archivo": "fonts/caveat-latin-ext-700-normal.woff2"},
      {"familia": "Caveat", "peso": 700, "estilo": "normal", "archivo": "fonts/caveat-latin-700-normal.woff2"},
      {"familia": "JetBrains Mono", "peso": 400, "estilo": "normal", "archivo": "fonts/jetbrains-mono-latin-ext-400-normal.woff2"},
      {"familia": "JetBrains Mono", "peso": 400, "estilo": "normal", "archivo": "fonts/jetbrains-mono-latin-400-normal.woff2"}
    ]
  },
  "forma": {"radio": 18, "radioPildora": 999, "borde": 3, "sombra": "0 18px 40px rgba(60,40,20,0.18)"},
  "fondo": {"tipo": "papel", "detalle": "papel de acuarela cálido con textura; manchas de aguada de la paleta de la ilustración en las esquinas; la ilustración a sangre con parallax 2,5D"},
  "paneles": {"estilo": "papel"},
  "ponente": {"marco": "redondeado", "borde": false},
  "subtitulos": {"estilo": "caja", "palabraActiva": "acento"},
  "movimiento": {"energia": "media", "entrada": "power2Out", "duracionEntrada": 0.7, "transicion": "fundido"},
  "tres": {"material": "toon", "contornoTinta": true, "rampa": 3},
  "audio": {"musica": "ninguna", "sfx": "suaves"},
  "licencias": "Nunito, Caveat, JetBrains Mono: SIL Open Font License 1.1 (fonts/OFL-*.txt), woff2 de @fontsource 5.3.0 (subconjuntos latin y latin-ext)."
}
