{
  "nombre": "senal-informativo",
  "descripcion": "Informativo de actualidad como «señal interceptada»: negro cálido, un solo acento naranja señal, League Gothic en mayúsculas e IBM Plex Mono de instrumento",
  "modo": "oscuro",
  "color": {
    "fondo": "#0B0C0E", "superficie": "#15171B", "superficie2": "#1D1F24", "linea": "#303031",
    "texto": "#F2EEE7", "textoSuave": "#8E8A83", "acento": "#FF5B2E", "ok": "#6FD08C",
    "aviso": "#F2C14E", "error": "#FF4D6D",
    "capitulos": ["#FF5B2E", "#FF5B2E", "#FF5B2E", "#FF5B2E"]
  },
  "tipografia": {
    "titular":   {"familia": "League Gothic", "peso": 400, "tracking": "-0.005em", "interlineado": 0.9, "mayusculas": true},
    "cuerpo":    {"familia": "IBM Plex Mono", "peso": 400, "interlineado": 1.4},
    "etiqueta":  {"familia": "IBM Plex Mono", "peso": 700, "tracking": "0.16em", "mayusculas": true},
    "mono":      {"familia": "IBM Plex Mono", "peso": 400},
    "archivos": [
      {"familia": "League Gothic", "peso": 400, "estilo": "normal", "archivo": "fonts/league-gothic-latin-ext-400-normal.woff2"},
      {"familia": "League Gothic", "peso": 400, "estilo": "normal", "archivo": "fonts/league-gothic-latin-400-normal.woff2"},
      {"familia": "IBM Plex Mono", "peso": 400, "estilo": "normal", "archivo": "fonts/ibm-plex-mono-latin-ext-400-normal.woff2"},
      {"familia": "IBM Plex Mono", "peso": 400, "estilo": "normal", "archivo": "fonts/ibm-plex-mono-latin-400-normal.woff2"},
      {"familia": "IBM Plex Mono", "peso": 700, "estilo": "normal", "archivo": "fonts/ibm-plex-mono-latin-ext-700-normal.woff2"},
      {"familia": "IBM Plex Mono", "peso": 700, "estilo": "normal", "archivo": "fonts/ibm-plex-mono-latin-700-normal.woff2"}
    ]
  },
  "forma": {"radio": 20, "radioPildora": 0, "borde": 3, "sombra": "0 40px 120px rgba(0,0,0,0.6)"},
  "fondo": {"tipo": "rejilla", "detalle": "rejilla de 80 px al 7 % que deriva, halo radial del acento (26 % → 0) que respira, número fantasma gigante con contorno, marcas de registro y grano al 7 %"},
  "paneles": {"estilo": "solido"},
  "ponente": {"marco": "recto", "borde": true},
  "subtitulos": {"estilo": "caja", "palabraActiva": "acento"},
  "movimiento": {"energia": "alta", "entrada": "expoOut", "duracionEntrada": 0.5, "transicion": "barrido"},
  "tres": {"material": "estandar", "contornoTinta": false, "rampa": 3},
  "audio": {"musica": "electronica", "sfx": "marcados"},
  "licencias": "League Gothic, IBM Plex Mono: SIL Open Font License 1.1 (fonts/OFL-*.txt), woff2 de @fontsource 5.3.0 (subconjuntos latin y latin-ext)."
}
