{
  "nombre": "cuaderno-a-mano",
  "descripcion": "Pizarra/cuaderno dibujado a mano: papel marfil con retícula de puntos, tinta que se traza sola, subrayador lima y cámara que recorre un lienzo grande de viñeta en viñeta",
  "modo": "claro",
  "color": {
    "fondo": "#F7F8F2", "superficie": "#FFFFFF", "superficie2": "#D6F469", "linea": "#D3D9CF",
    "texto": "#10231D", "textoSuave": "#50614B", "acento": "#173F32", "ok": "#2E7D4F",
    "aviso": "#9A6A12", "error": "#B23A2A",
    "capitulos": ["#173F32", "#1F5A8C", "#A23B2A", "#6B4E9B"]
  },
  "tipografia": {
    "titular":   {"familia": "Patrick Hand", "peso": 400, "tracking": "0em", "interlineado": 1.1},
    "cuerpo":    {"familia": "Patrick Hand", "peso": 400, "interlineado": 1.3},
    "etiqueta":  {"familia": "DM Sans", "peso": 700, "tracking": "0.18em", "mayusculas": true},
    "mono":      {"familia": "DM Mono", "peso": 400},
    "archivos": [
      {"familia": "Patrick Hand", "peso": 400, "estilo": "normal", "archivo": "fonts/patrick-hand-latin-ext-400-normal.woff2"},
      {"familia": "Patrick Hand", "peso": 400, "estilo": "normal", "archivo": "fonts/patrick-hand-latin-400-normal.woff2"},
      {"familia": "DM Sans", "peso": 700, "estilo": "normal", "archivo": "fonts/dm-sans-latin-ext-700-normal.woff2"},
      {"familia": "DM Sans", "peso": 700, "estilo": "normal", "archivo": "fonts/dm-sans-latin-700-normal.woff2"},
      {"familia": "DM Mono", "peso": 400, "estilo": "normal", "archivo": "fonts/dm-mono-latin-ext-400-normal.woff2"},
      {"familia": "DM Mono", "peso": 400, "estilo": "normal", "archivo": "fonts/dm-mono-latin-400-normal.woff2"}
    ]
  },
  "forma": {"radio": 24, "radioPildora": 999, "borde": 6, "sombra": "none"},
  "fondo": {"tipo": "papel", "detalle": "papel marfil con retícula de puntos (se atenúa al alejar la cámara) y grano de papel en multiplicar al 60 %"},
  "paneles": {"estilo": "papel"},
  "ponente": {"marco": "redondeado", "borde": true},
  "subtitulos": {"estilo": "limpio", "palabraActiva": "subrayado"},
  "movimiento": {"energia": "media", "entrada": "sineInOut", "duracionEntrada": 0.8, "transicion": "empuje"},
  "tres": {"material": "toon", "contornoTinta": true, "rampa": 2},
  "audio": {"musica": "pad", "sfx": "suaves"},
  "licencias": "Patrick Hand, DM Sans, DM Mono: SIL Open Font License 1.1 (fonts/OFL-*.txt), woff2 de @fontsource 5.3.0 (subconjuntos latin y latin-ext). La letra trazada a rotulador es un alfabeto propio en código (sin fuente)."
}
