{
  "nombre": "dibujos-animados",
  "descripcion": "Serie de dibujos animados de sábado por la mañana: trazo grueso de tinta, colores planos, rayos de sol, bocadillos, onomatopeyas y animación «a doses» (12 dibujos/s)",
  "modo": "oscuro",
  "color": {
    "fondo": "#173F32", "superficie": "#10231D", "superficie2": "#0F2D24", "linea": "#10231D",
    "texto": "#F7F8F2", "textoSuave": "#B6C6BB", "acento": "#D6F469", "ok": "#7BD88F",
    "aviso": "#FFE066", "error": "#FF6B57",
    "capitulos": ["#D6F469", "#FFE066", "#FF8A73", "#8FD3F4"]
  },
  "tipografia": {
    "titular":   {"familia": "Inter Tight", "peso": 800, "tracking": "-0.02em", "interlineado": 1, "mayusculas": true},
    "cuerpo":    {"familia": "DM Sans", "peso": 700, "interlineado": 1.15},
    "etiqueta":  {"familia": "Inter Tight", "peso": 800, "tracking": "0.03em", "mayusculas": true},
    "mono":      {"familia": "DM Mono", "peso": 400},
    "archivos": [
      {"familia": "Inter Tight", "peso": 800, "estilo": "normal", "archivo": "fonts/inter-tight-latin-ext-800-normal.woff2"},
      {"familia": "Inter Tight", "peso": 800, "estilo": "normal", "archivo": "fonts/inter-tight-latin-800-normal.woff2"},
      {"familia": "DM Sans", "peso": 400, "estilo": "normal", "archivo": "fonts/dm-sans-latin-ext-400-normal.woff2"},
      {"familia": "DM Sans", "peso": 400, "estilo": "normal", "archivo": "fonts/dm-sans-latin-400-normal.woff2"},
      {"familia": "DM Sans", "peso": 700, "estilo": "normal", "archivo": "fonts/dm-sans-latin-ext-700-normal.woff2"},
      {"familia": "DM Sans", "peso": 700, "estilo": "normal", "archivo": "fonts/dm-sans-latin-700-normal.woff2"},
      {"familia": "DM Mono", "peso": 400, "estilo": "normal", "archivo": "fonts/dm-mono-latin-ext-400-normal.woff2"},
      {"familia": "DM Mono", "peso": 400, "estilo": "normal", "archivo": "fonts/dm-mono-latin-400-normal.woff2"}
    ]
  },
  "forma": {"radio": 22, "radioPildora": 999, "borde": 7, "sombra": "10px 12px 0 #10231D"},
  "fondo": {"tipo": "radial", "detalle": "rayos de sol (sunburst) de dos tonos que giran despacio detrás del personaje; decorados planos con contorno de tinta y temblor «boil»"},
  "paneles": {"estilo": "tinta"},
  "ponente": {"marco": "circulo", "borde": true},
  "subtitulos": {"estilo": "caja", "palabraActiva": "ninguna"},
  "movimiento": {"energia": "alta", "entrada": "backOut", "duracionEntrada": 0.3, "transicion": "barrido"},
  "tres": {"material": "toon", "contornoTinta": true, "rampa": 3},
  "audio": {"musica": "fanfarria", "sfx": "comicos"},
  "licencias": "Inter Tight, DM Sans, DM Mono: SIL Open Font License 1.1 (fonts/OFL-*.txt), woff2 de @fontsource 5.3.0 (subconjuntos latin y latin-ext)."
}
